{
  "$schema": "https://json-schema.org/draft/2020-12/schema",
  "type": "object",
  "properties": {
    "format": {
      "type": "string",
      "const": "runproof.run-detail"
    },
    "schema_version": {
      "type": "number",
      "const": 1
    },
    "source_kind": {
      "type": "string",
      "enum": [
        "fixture",
        "operator_capture"
      ]
    },
    "runproof": {
      "type": "object",
      "properties": {
        "main_sha": {
          "type": "string",
          "pattern": "^[0-9a-f]{40}$"
        },
        "basis": {
          "type": "string",
          "minLength": 1,
          "maxLength": 500
        }
      },
      "required": [
        "main_sha",
        "basis"
      ],
      "additionalProperties": false
    },
    "run": {
      "type": "object",
      "properties": {
        "id": {
          "type": "string",
          "pattern": "^[A-Za-z0-9][A-Za-z0-9._:-]{0,127}$"
        },
        "external_run_id": {
          "type": "string",
          "minLength": 1,
          "maxLength": 200
        },
        "execution_status": {
          "type": "string",
          "enum": [
            "running",
            "succeeded",
            "failed",
            "missing"
          ]
        },
        "outcome": {
          "type": "string",
          "enum": [
            "pending",
            "verified",
            "failed",
            "unknown"
          ]
        },
        "finished_at": {
          "anyOf": [
            {
              "type": "string",
              "pattern": "^(\\d{4})-(\\d{2})-(\\d{2})T(\\d{2}):(\\d{2}):(\\d{2})(?:\\.(\\d{1,3}))?Z$"
            },
            {
              "type": "null"
            }
          ]
        },
        "checks": {
          "maxItems": 5000,
          "type": "array",
          "items": {
            "type": "object",
            "properties": {
              "id": {
                "type": "string",
                "maxLength": 200
              },
              "evaluation": {
                "type": "integer",
                "minimum": 0,
                "maximum": 9007199254740991
              },
              "definition_id": {
                "type": "string",
                "maxLength": 200
              },
              "required": {
                "type": "boolean"
              },
              "state": {
                "type": "string",
                "enum": [
                  "pending",
                  "pass",
                  "fail",
                  "unknown"
                ]
              }
            },
            "required": [
              "id",
              "evaluation",
              "definition_id",
              "required",
              "state"
            ],
            "additionalProperties": {}
          }
        },
        "exit_code": {
          "anyOf": [
            {
              "type": "integer",
              "minimum": -9007199254740991,
              "maximum": 9007199254740991
            },
            {
              "type": "null"
            }
          ]
        },
        "exitCode": {
          "anyOf": [
            {
              "type": "integer",
              "minimum": -9007199254740991,
              "maximum": 9007199254740991
            },
            {
              "type": "null"
            }
          ]
        }
      },
      "required": [
        "id",
        "external_run_id",
        "execution_status",
        "outcome",
        "finished_at",
        "checks"
      ],
      "additionalProperties": {}
    },
    "binding": {
      "type": "object",
      "properties": {
        "requirement_ids": {
          "minItems": 1,
          "maxItems": 200,
          "type": "array",
          "items": {
            "type": "string",
            "pattern": "^[A-Za-z0-9][A-Za-z0-9._-]{0,63}$"
          }
        },
        "repository": {
          "type": "string",
          "pattern": "^[A-Za-z0-9][A-Za-z0-9._/-]{0,99}$"
        },
        "commit_sha": {
          "type": "string",
          "pattern": "^[0-9a-f]{40}$"
        },
        "environment": {
          "type": "string",
          "minLength": 1,
          "maxLength": 100
        },
        "test_level": {
          "type": "string",
          "enum": [
            "unit",
            "integration",
            "e2e"
          ]
        },
        "execution_kind": {
          "type": "string",
          "enum": [
            "live",
            "mocked",
            "synthetic"
          ]
        },
        "runner_id": {
          "type": "string",
          "minLength": 1,
          "maxLength": 200
        },
        "artifact": {
          "type": "object",
          "properties": {
            "path": {
              "type": "string",
              "minLength": 1,
              "maxLength": 512
            },
            "sha256": {
              "type": "string",
              "pattern": "^[0-9a-f]{64}$"
            }
          },
          "required": [
            "path",
            "sha256"
          ],
          "additionalProperties": false
        }
      },
      "required": [
        "requirement_ids",
        "repository",
        "commit_sha",
        "environment",
        "test_level",
        "execution_kind",
        "artifact"
      ],
      "additionalProperties": false
    }
  },
  "required": [
    "format",
    "schema_version",
    "source_kind",
    "runproof",
    "run",
    "binding"
  ],
  "additionalProperties": false,
  "$id": "urn:proofgate:schema:runproof-run-detail:1",
  "title": "RunProof run-detail import document"
}
